{
  "schemaVersion": 2,
  "meta": {
    "id": "plan-empty",
    "name": "空白方案",
    "createdAt": 1790726400000,
    "updatedAt": 1790726400000,
    "unit": "mm",
    "displayUnit": "metric",
    "codeset": "cn",
    "template": null
  },
  "floors": [
    {
      "id": "f1",
      "name": "1F",
      "elevation": 0,
      "height": 2900,
      "slab": 200,
      "ceiling": 2800,
      "nodes": [],
      "walls": [],
      "openings": [],
      "rooms": [],
      "furniture": [],
      "voids": []
    }
  ],
  "stairs": []
}
